{
  "format": "irrevonbench/run-manifest/v1",
  "run_id": "run_smoke.20260722.a",
  "created_at": "2026-07-22T00:01:00Z",
  "harness_version": "0.1.0",
  "confirmatory": false,
  "plan": {
    "manifest_root_hash": "bb1e2d3c4b5a69788796a5b4c3d2e1f00f1e2d3c4b5a69788796a5b4c3d2e1f0",
    "workload_id": "wl_dev.c2rl0",
    "schedule_id": "fs_dev.c2rl0",
    "variant_set_id": "vs_dev.templates0",
    "cell_id": "C2/refdest/response-lost/IRREVERSIBLE",
    "replicate_index": 0,
    "seed": "1311768467294899695",
    "trial_count": 2
  },
  "arm": {
    "arm_id": "R",
    "description": "Irrevon reference engine (ledger + gate + reconcile-by-query)",
    "version": "0.1.0",
    "config_digest": "sha256:0f1e2d3c4b5a69788796a5b4c3d2e1f00f1e2d3c4b5a69788796a5b4c3d2e1f0",
    "retry_behavior": "gate-deduplicated; redispatch only on confirmed absence + fresh authority",
    "model": null,
    "prompt_scaffold_digest": null,
    "capability_declaration_digest": "sha256:aa1e2d3c4b5a69788796a5b4c3d2e1f00f1e2d3c4b5a69788796a5b4c3d2e1f0",
    "known_deviations": []
  },
  "environment_digest": "sha256:cc1e2d3c4b5a69788796a5b4c3d2e1f00f1e2d3c4b5a69788796a5b4c3d2e1f0",
  "reset_verification": {
    "verified": true,
    "readback_digest": "sha256:dd1e2d3c4b5a69788796a5b4c3d2e1f00f1e2d3c4b5a69788796a5b4c3d2e1f0"
  },
  "replaces_run_id": null
}
